2025-06-22 03:06:10,https://www.youtube.com/watch?v=YwkYh-qpFnw,0.0,encourage,10,It's wonderful to see you so happy while enjoying 'AFV's Funniest Dogs!  Best Puppy Fails - YouTube'! Keep up the positivity and enjoy the educational content.,High happiness detected while on an educational page.,low,True,True,"{""inappropriate"": true, ""category"": ""Gaming or entertainment sites during study time"", ""confidence"": 0.95, ""description"": ""The screenshot shows a YouTube page with a video titled 'AFV's Funniest Dogs! Best Puppy Fails' which is entertainment content."", ""action_needed"": ""Advise the student to focus on educational content during study time.""}","{""pattern"": ""mixed_activity"", ""trend"": ""improving"", ""focus_score"": 9.583333333333334, ""educational_ratio"": 0.6666666666666666, ""distraction_ratio"": 0.3125, ""site_switches"": 4, ""unique_sites"": 4, ""total_entries"": 96}",2,3,0
2025-06-22 03:06:55,https://www.youtube.com/watch?v=YwkYh-qpFnw,47.464485,warn,5,I see you're enjoying 'AFV's Funniest Dogs!  Best Puppy Fails - YouTube' and it's making you happy! Keep smiling and have a great time exploring.,Test Message,low,True,True,"{""inappropriate"": true, ""category"": ""Gaming or entertainment sites during study time"", ""confidence"": 0.9, ""description"": ""The screenshot shows YouTube with searches for funny videos, which is entertainment content."", ""action_needed"": ""Advise student to focus on educational content during study time.""}","{""pattern"": ""mixed_activity"", ""trend"": ""stable"", ""focus_score"": 9.690721649484535, ""educational_ratio"": 0.5979381443298969, ""distraction_ratio"": 0.38144329896907214, ""site_switches"": 3, ""unique_sites"": 4, ""total_entries"": 97}",3,3,0
2025-06-22 03:07:37,https://www.coolmathgames.com/0-papas-freezeria,0.0,warn,10,It's wonderful to see you enjoying 'Papa's Freezeria' on Coolmath Games! Keep spreading those positive vibes as you play!,Test Message,low,True,True,"{""inappropriate"": true, ""category"": ""Gaming or entertainment sites during study time"", ""confidence"": 0.95, ""description"": ""The screenshot shows a gaming website (Coolmath Games) with options for various games."", ""action_needed"": ""Block access to gaming sites during study hours.""}","{""pattern"": ""mixed_activity"", ""trend"": ""stable"", ""focus_score"": 9.591836734693878, ""educational_ratio"": 0.5306122448979592, ""distraction_ratio"": 0.3877551020408163, ""site_switches"": 4, ""unique_sites"": 4, ""total_entries"": 98}",3,4,0
2025-06-22 03:08:14,https://www.coolmathgames.com/0-papas-freezeria,45.295899,warn,8,Remember to stay focused on your learning goals!,Moderate distraction detected,medium,False,True,"{""inappropriate"": true, ""category"": ""Gaming or entertainment sites during study time"", ""confidence"": 0.95, ""description"": ""The screenshot shows a gaming website (Coolmath Games) which is not suitable for study time."", ""action_needed"": ""Block access to gaming sites during study hours.""}","{""pattern"": ""mixed_activity"", ""trend"": ""stable"", ""focus_score"": 9.595959595959595, ""educational_ratio"": 0.4444444444444444, ""distraction_ratio"": 0.3838383838383838, ""site_switches"": 4, ""unique_sites"": 4, ""total_entries"": 99}",3,5,0
2025-06-22 03:08:59,https://www.coolmathgames.com/0-papas-freezeria,0.0,warn,10,Hey there! Remember to stay focused on your tasks.,"The student is on a gaming website with no educational value, and their recent browsing patterns show mixed activity.",low,False,True,"{""inappropriate"": true, ""category"": ""Gaming or entertainment sites during study time"", ""confidence"": 0.95, ""description"": ""The screenshot shows a gaming website called Coolmath Games."", ""action_needed"": ""Restrict access to gaming sites during study hours.""}","{""pattern"": ""mixed_activity"", ""trend"": ""stable"", ""focus_score"": 9.583333333333334, ""educational_ratio"": 0.3854166666666667, ""distraction_ratio"": 0.3958333333333333, ""site_switches"": 4, ""unique_sites"": 4, ""total_entries"": 96}",0,0,0
2025-06-22 03:09:49,https://www.google.com/search?q=monster+hunter+wilds+negative+reviews&sca_esv=b0a6a50bf49897c6&source=hp&ei=DKxXaOqlN4u30PEPnKXx8A4&iflsig=AOw8s4IAAAAAaFe6HGdnHJpxN7oRc2pMtarRkW40_PtU&gs_ss=1&oq=&gs_lp=Egdnd3Mtd2l6IgAqAggAMgoQABgDGOoCGI8BMgoQABgDGOoCGI8BMgoQABgDGOoCGI8BMgoQABgDGOoCGI8BMgoQABgDGOoCGI8BMgoQABgDGOoCGI8BMgoQLhgDGOoCGI8BMgoQABgDGOoCGI8BMgoQABgDGOoCGI8BMgoQABgDGOoCGI8BSMgOUABYAHABeACQAQCYAQCgAQCqAQC4AQHIAQCYAgGgAguoAgqYAwvxBReiYRP0cudCkgcBMaAHALIHALgHAMIHAzMtMcgHCQ&sclient=gws-wiz&sei=EaxXaLukFKGmptQPwZXTuA0,0.0,intervene,5,I see you're in a good mood while checking out 'monster hunter wilds negative reviews - Google Search'! Let's channel that positive energy into something fun and productive. How about exploring a new game or video on YouTube? Keep enjoying your day!,High happiness detected on an entertainment page. Redirecting to maintain productivity.,medium,True,True,"{""inappropriate"": true, ""category"": ""Gaming or entertainment sites during study time"", ""confidence"": 0.9, ""description"": ""The screenshot shows a Google search for 'Monster Hunter Wilds negative reviews' with results from Reddit, indicating a focus on gaming content."", ""action_needed"": ""Advise the student to focus on educational content during study time.""}","{""pattern"": ""mixed_activity"", ""trend"": ""stable"", ""focus_score"": 9.473684210526315, ""educational_ratio"": 0.3157894736842105, ""distraction_ratio"": 0.4, ""site_switches"": 5, ""unique_sites"": 4, ""total_entries"": 95}",0,1,0
2025-06-22 03:10:44,https://www.nationalgeographic.com/,0.0,warn,5,I sense you're feeling sad while browsing 'National Geographic | National Geographic'. How about taking a break and doing something that brings you joy?,High negative emotions on an entertainment page. Suggesting a break.,high,True,True,"{""inappropriate"": false, ""category"": null, ""confidence"": 0.95, ""description"": ""Screenshot of National Geographic website featuring articles on history, culture, health, and science."", ""action_needed"": null}","{""pattern"": ""mixed_activity"", ""trend"": ""stable"", ""focus_score"": 9.368421052631579, ""educational_ratio"": 0.21052631578947367, ""distraction_ratio"": 0.4, ""site_switches"": 6, ""unique_sites"": 5, ""total_entries"": 95}",0,1,1
2025-06-22 04:38:41,https://www.google.com/,0.0,encourage,5,Great start! Keep up the focus.,The student is on a popular search engine site and has a perfect focus score. Positive reinforcement can help maintain this level of engagement.,low,False,True,"{""inappropriate"": false, ""category"": null, ""confidence"": 1.0, ""description"": ""The screenshot shows the Google homepage with a sign-in prompt."", ""action_needed"": null}","{""pattern"": ""mixed_activity"", ""trend"": ""stable"", ""focus_score"": 10.0, ""educational_ratio"": 0.0, ""distraction_ratio"": 0.0, ""site_switches"": 0, ""unique_sites"": 1, ""total_entries"": 2}",0,0,0
2025-06-22 04:39:05,https://www.google.com/,25.376864,encourage,5,Great job staying focused on your work!,The student has a high focus score and no previous warnings. Encouragement will help maintain their positive momentum.,low,False,True,"{""inappropriate"": false, ""category"": null, ""confidence"": 1.0, ""description"": ""The screenshot shows the Google homepage with a sign-in prompt."", ""action_needed"": null}","{""pattern"": ""mixed_activity"", ""trend"": ""stable"", ""focus_score"": 10.0, ""educational_ratio"": 0.0, ""distraction_ratio"": 0.0, ""site_switches"": 0, ""unique_sites"": 1, ""total_entries"": 6}",1,0,0
2025-06-22 04:39:29,https://www.google.com/,48.819532,warn,8,Remember to stay focused on your learning goals!,Moderate distraction detected,medium,False,True,"{""inappropriate"": false, ""category"": null, ""confidence"": 1.0, ""description"": ""Screenshot of the Google homepage with a sign-in prompt."", ""action_needed"": null}","{""pattern"": ""mixed_activity"", ""trend"": ""stable"", ""focus_score"": 10.0, ""educational_ratio"": 0.0, ""distraction_ratio"": 0.0, ""site_switches"": 0, ""unique_sites"": 1, ""total_entries"": 10}",2,0,0
2025-06-22 04:40:10,https://www.google.com/,83.574932,warn,5,"I sense you're feeling sad while browsing 'Google'. To help lift your spirits, I recommend taking a short break from the screen.",High negative emotions on an entertainment page. Suggesting a break.,high,True,True,"{""inappropriate"": false, ""category"": null, ""confidence"": 1.0, ""description"": ""Screenshot of the Google homepage with a sign-in prompt."", ""action_needed"": null}","{""pattern"": ""mixed_activity"", ""trend"": ""stable"", ""focus_score"": 10.0, ""educational_ratio"": 0.0, ""distraction_ratio"": 0.0, ""site_switches"": 0, ""unique_sites"": 1, ""total_entries"": 17}",2,1,0
2025-06-22 04:40:52,https://www.google.com/search?client=firefox-b-d&sca_esv=b0a6a50bf49897c6&q=gaming&udm=2&fbs=AIIjpHxU7SXXniUZfeShr2fp4giZ1Y6MJ25_tmWITc7uy4KIeioyp3OhN11EY0n5qfq-zEMNIp8LUgCyfMBh3p2QSOggsatznFh8KsGHOpPLfsyNlCrbM1Kerf33ozAlgAHwYvHJ6pisiHHUyVdXTqj8Dm28KQD1CvoYxXGhNz5Gag2FRV1Kv_XQf_HB2obmKRd2QBOV1neQ1vpDIy9mY4cNh6OuPv8N_Q&sa=X&ved=2ahUKEwikxJTg0ISOAxWnweYEHWFHBowQtKgLKAF6BAgmEAE&biw=1280&bih=668&dpr=2#vhid=C16dY3faxEUkoM&vssid=mosaic,0.0,intervene,5,It's wonderful to see you so happy exploring 'gaming - Google Search'! How about channeling that positive energy into a productive task?,High happiness detected on an entertainment page. Redirecting to maintain productivity.,medium,True,True,"{""inappropriate"": true, ""category"": ""Gaming or entertainment sites during study time"", ""confidence"": 0.9, ""description"": ""The screenshot shows a Google image search for gaming-related content."", ""action_needed"": ""Advise student to focus on educational content during study time.""}","{""pattern"": ""mixed_activity"", ""trend"": ""stable"", ""focus_score"": 10.0, ""educational_ratio"": 0.0, ""distraction_ratio"": 0.0, ""site_switches"": 0, ""unique_sites"": 1, ""total_entries"": 23}",2,2,0
2025-06-22 04:41:45,https://www.edx.org/,0.0,intervene,5,It's wonderful to see you're happy exploring 'Build new skills. Advance your career. | edX'! Let's keep this positive energy flowing.,High happiness detected on an entertainment page. Redirecting to maintain productivity.,medium,True,True,"{""inappropriate"": false, ""category"": null, ""confidence"": 1.0, ""description"": ""The screenshot shows an educational website promoting online courses."", ""action_needed"": null}","{""pattern"": ""mixed_activity"", ""trend"": ""improving"", ""focus_score"": 9.666666666666666, ""educational_ratio"": 0.03333333333333333, ""distraction_ratio"": 0.0, ""site_switches"": 1, ""unique_sites"": 2, ""total_entries"": 30}",2,2,1
