2025-06-22 02:26:52,https://www.coursera.org/,0.0,intervene,0,Hey there! Let's refocus on educational content.,The student is on a site with unknown educational value and has a heavy distraction browsing pattern. Immediate intervention is needed to steer them back on track.,high,True,"{""inappropriate"": false, ""category"": null, ""confidence"": 0.95, ""description"": ""Screenshot of an educational platform offering online courses."", ""action_needed"": null}","{""pattern"": ""heavy_distraction"", ""trend"": ""declining"", ""focus_score"": 8.983050847457626, ""educational_ratio"": 0.03389830508474576, ""distraction_ratio"": 0.6779661016949152, ""site_switches"": 6, ""unique_sites"": 4, ""total_entries"": 59}",0,0,0
2025-06-22 02:27:34,https://www.google.com/search?client=firefox-b-d&q=men+kissing&sei=SKJXaKn4PMfikPIP4PKVqA4,0.0,warn,5,Hey there! Remember to stay focused on educational content.,The current site may be distracting and not educational. A gentle reminder can help steer the student back on track.,medium,True,"{""inappropriate"": false, ""category"": null, ""confidence"": 0.9, ""description"": ""The screenshot shows search results for 'men kissing' with various images of men kissing."", ""action_needed"": ""No action needed.""}","{""pattern"": ""heavy_distraction"", ""trend"": ""declining"", ""focus_score"": 8.596491228070175, ""educational_ratio"": 0.05263157894736842, ""distraction_ratio"": 0.631578947368421, ""site_switches"": 8, ""unique_sites"": 5, ""total_entries"": 57}",0,0,1
2025-06-22 02:28:09,https://www.youtube.com/watch?v=OxHUiHwMABs,0.0,warn,10,Hey there! Remember to stay focused on educational content.,The student is on a heavily distracting site with no educational value. A gentle reminder is needed to steer them back on track.,medium,True,"{""inappropriate"": false, ""category"": null, ""confidence"": 0.9, ""description"": ""The screenshot shows a YouTube video titled 'HOW TO GAY KISS (ft. my straight friend)' with related video suggestions. No explicit, violent, or inappropriate content for educational purposes is visible."", ""action_needed"": ""No action needed""}","{""pattern"": ""heavy_distraction"", ""trend"": ""declining"", ""focus_score"": 8.421052631578947, ""educational_ratio"": 0.05263157894736842, ""distraction_ratio"": 0.6140350877192983, ""site_switches"": 9, ""unique_sites"": 5, ""total_entries"": 57}",0,1,1
2025-06-22 02:28:39,https://www.youtube.com/watch?v=77j9j0eEd4E,0.0,intervene,0,Let's refocus on educational content.,The video on 'DIRTIEST Hits In NHL History' is not suitable for your current learning goals.,high,True,"{""inappropriate"": true, ""category"": ""Violence or disturbing imagery"", ""confidence"": 0.9, ""description"": ""The video titled 'DIRTIEST Hits In NHL History' suggests content related to violent sports incidents."", ""action_needed"": ""Review video content for appropriateness in an educational setting.""}","{""pattern"": ""heavy_distraction"", ""trend"": ""declining"", ""focus_score"": 8.392857142857142, ""educational_ratio"": 0.05357142857142857, ""distraction_ratio"": 0.6071428571428571, ""site_switches"": 9, ""unique_sites"": 5, ""total_entries"": 56}",0,2,1
2025-06-22 02:29:16,https://www.ted.com/,0.0,encourage,5,Great choice exploring TED Talks! Keep up the curiosity!,The student is on a potentially educational site with a focus score of 8.18. Positive reinforcement can help maintain their engagement.,low,True,"{""inappropriate"": false, ""category"": null, ""confidence"": 0.95, ""description"": ""Screenshot of a TED Talk webpage featuring a musical duet with AI."", ""action_needed"": ""None""}","{""pattern"": ""mixed_activity"", ""trend"": ""declining"", ""focus_score"": 8.181818181818182, ""educational_ratio"": 0.05454545454545454, ""distraction_ratio"": 0.5636363636363636, ""site_switches"": 10, ""unique_sites"": 6, ""total_entries"": 55}",0,2,2
2025-06-22 02:29:40,https://www.ted.com/,25.00946,encourage,5,Great job exploring TED for new ideas! Keep up the good work!,The student is on an educational site with a decent focus score. Positive reinforcement can help maintain their focus.,low,True,"{""inappropriate"": false, ""category"": null, ""confidence"": 0.95, ""description"": ""The screenshot shows a TED website with a membership pop-up."", ""action_needed"": null}","{""pattern"": ""mixed_activity"", ""trend"": ""declining"", ""focus_score"": 8.148148148148149, ""educational_ratio"": 0.05555555555555555, ""distraction_ratio"": 0.48148148148148145, ""site_switches"": 10, ""unique_sites"": 6, ""total_entries"": 54}",1,2,2
2025-06-22 02:30:07,https://www.youtube.com/shorts/aWCcJ7wIoSI,0.0,intervene,0,Let's redirect to more positive and educational content!,"The current video title suggests violent content, and the student's browsing patterns show a decline in focus. It's important to intervene quickly to steer them back on track.",high,True,"{""inappropriate"": true, ""category"": ""Violence or disturbing imagery"", ""confidence"": 0.9, ""description"": ""The screenshot shows a YouTube video titled 'Angry Elephant Attack On Lady' which suggests violent or disturbing content."", ""action_needed"": ""Block access to this content and monitor for similar searches.""}","{""pattern"": ""mixed_activity"", ""trend"": ""declining"", ""focus_score"": 7.962962962962964, ""educational_ratio"": 0.05555555555555555, ""distraction_ratio"": 0.48148148148148145, ""site_switches"": 11, ""unique_sites"": 6, ""total_entries"": 54}",2,2,2
2025-06-22 02:35:36,https://www.ted.com/education,0.0,encourage,5,Keep up the good work! Try exploring other educational resources.,"The student has just landed on a 404 error page, so a positive encouragement can help redirect their focus.",low,True,"{""inappropriate"": false, ""category"": null, ""confidence"": 0.95, ""description"": ""The screenshot shows a 404 error page from the TED website."", ""action_needed"": null}","{""pattern"": ""mixed_activity"", ""trend"": ""declining"", ""focus_score"": 8.125, ""educational_ratio"": 0.03125, ""distraction_ratio"": 0.59375, ""site_switches"": 6, ""unique_sites"": 4, ""total_entries"": 32}",0,0,0
2025-06-22 02:35:59,https://www.google.com/search?client=firefox-b-d&q=national+geographic,0.0,encourage,5,Great job looking up National Geographic! Keep up the curiosity!,The student is on an educational site and the browsing focus score is high.,low,True,"{""inappropriate"": false, ""category"": ""unknown"", ""confidence"": 0.5, ""description"": ""I'm unable to analyze the content of the screenshot as it appears to be blank or not visible. Please provide a different image or ensure the screenshot is properly uploaded."", ""action_needed"": ""none""}","{""pattern"": ""mixed_activity"", ""trend"": ""declining"", ""focus_score"": 8.055555555555555, ""educational_ratio"": 0.027777777777777776, ""distraction_ratio"": 0.5277777777777778, ""site_switches"": 7, ""unique_sites"": 4, ""total_entries"": 36}",1,0,0
2025-06-22 02:36:23,https://www.nationalgeographic.com/subscribe/topic/natgeo?cmpid=org=ngp::mc=cpc::src=pmax::cmp=acqq225_ngm::add=&gclsrc=aw.ds&gad_source=1&gad_campaignid=21250665839&gclid=EAIaIQobChMI3fby-7SEjgMVDTUIBR0AIiMMEAAYASAAEgJ7bvD_BwE,0.0,encourage,5,Great choice exploring National Geographic! Keep up the curious spirit!,"The student is on an educational site, although briefly. Positive reinforcement can help maintain focus.",low,True,"{""inappropriate"": false, ""category"": null, ""confidence"": 0.95, ""description"": ""The screenshot shows a National Geographic Magazine subscription page, which includes information about print and digital subscriptions."", ""action_needed"": null}","{""pattern"": ""mixed_activity"", ""trend"": ""declining"", ""focus_score"": 7.948717948717949, ""educational_ratio"": 0.02564102564102564, ""distraction_ratio"": 0.48717948717948717, ""site_switches"": 8, ""unique_sites"": 5, ""total_entries"": 39}",2,0,0
2025-06-22 02:36:59,https://www.nationalgeographic.com/subscribe/topic/natgeo?cmpid=org=ngp::mc=cpc::src=pmax::cmp=acqq225_ngm::add=&gclsrc=aw.ds&gad_source=1&gad_campaignid=21250665839&gclid=EAIaIQobChMI3fby-7SEjgMVDTUIBR0AIiMMEAAYASAAEgJ7bvD_BwE,24.184212,intervene,5,"I've noticed you seem very happy right now, which is great! Based on that, I'm redirecting you to an educational site to channel that positive energy into learning.",High happiness detected on an entertainment page. Redirecting to maintain productivity.,medium,True,"{""inappropriate"": false, ""category"": null, ""confidence"": 0.95, ""description"": ""The screenshot shows a National Geographic subscription page with information about print and digital options."", ""action_needed"": null}","{""pattern"": ""mixed_activity"", ""trend"": ""declining"", ""focus_score"": 8.181818181818182, ""educational_ratio"": 0.022727272727272728, ""distraction_ratio"": 0.4318181818181818, ""site_switches"": 8, ""unique_sites"": 5, ""total_entries"": 44}",3,0,0
2025-06-22 02:37:41,https://kids.nationalgeographic.com/,0.0,encourage,5,Great choice exploring National Geographic Kids! Keep up the curiosity!,The student is on an educational website and has a good focus score.,low,True,"{""inappropriate"": false, ""category"": null, ""confidence"": 0.95, ""description"": ""Screenshot of National Geographic Kids website featuring educational content about geckos."", ""action_needed"": ""None""}","{""pattern"": ""mixed_activity"", ""trend"": ""declining"", ""focus_score"": 8.72340425531915, ""educational_ratio"": 0.0, ""distraction_ratio"": 0.40425531914893614, ""site_switches"": 6, ""unique_sites"": 5, ""total_entries"": 47}",3,0,1
2025-06-22 02:38:05,https://www.youtube.com/,0.0,encourage,5,Great job exploring different sites! Remember to stay focused on your learning goals.,"The student's browsing patterns show a mix of activities, but their focus score is high. Positive reinforcement can help maintain their current focus.",low,True,"{""inappropriate"": true, ""category"": ""Social media during study time"", ""confidence"": 0.9, ""description"": ""The screenshot shows the YouTube homepage, which is a social media and entertainment platform."", ""action_needed"": ""Advise the student to focus on educational content or block access during study hours.""}","{""pattern"": ""mixed_activity"", ""trend"": ""declining"", ""focus_score"": 8.51063829787234, ""educational_ratio"": 0.0, ""distraction_ratio"": 0.3617021276595745, ""site_switches"": 7, ""unique_sites"": 5, ""total_entries"": 47}",4,0,1
2025-06-22 02:38:37,https://www.youtube.com/,23.928984,intervene,5,"I've noticed you seem very happy right now, which is great! Based on that, I'm redirecting you to an educational site to channel that positive energy into learning.",High happiness detected on an entertainment page. Redirecting to maintain productivity.,medium,True,"{""inappropriate"": true, ""category"": ""Social media during study time"", ""confidence"": 0.9, ""description"": ""The screenshot shows the YouTube homepage, which is a social media and entertainment site."", ""action_needed"": ""Advise the student to focus on educational content or block access during study hours.""}","{""pattern"": ""mixed_activity"", ""trend"": ""declining"", ""focus_score"": 8.541666666666666, ""educational_ratio"": 0.0, ""distraction_ratio"": 0.375, ""site_switches"": 7, ""unique_sites"": 5, ""total_entries"": 48}",5,0,1
2025-06-22 02:39:08,https://www.ted.com/,0.0,intervene,5,"I've noticed you seem very happy right now, which is great! Based on that, I'm redirecting you to an educational site to channel that positive energy into learning.",High happiness detected on an entertainment page. Redirecting to maintain productivity.,medium,True,"{""inappropriate"": false, ""category"": null, ""confidence"": 0.95, ""description"": ""Screenshot of a TED Talk webpage featuring a musical duet with AI."", ""action_needed"": null}","{""pattern"": ""mixed_activity"", ""trend"": ""declining"", ""focus_score"": 8.541666666666666, ""educational_ratio"": 0.0, ""distraction_ratio"": 0.375, ""site_switches"": 7, ""unique_sites"": 5, ""total_entries"": 48}",5,0,2
2025-06-22 02:39:38,https://www.nationalgeographic.com/education/,0.0,intervene,0,Let's focus on educational content. Redirecting you to a more relevant resource.,"The current site is showing an error message with no educational value. Your recent browsing patterns are mixed, but the focus score is high. It's important to steer you towards more productive content.",high,True,"{""inappropriate"": false, ""category"": null, ""confidence"": 0.95, ""description"": ""The screenshot shows a National Geographic webpage with an error message 'Something went wrong'. It includes links to various sections like Animals, History & Culture, and Science & Nature."", ""action_needed"": null}","{""pattern"": ""mixed_activity"", ""trend"": ""declining"", ""focus_score"": 8.571428571428571, ""educational_ratio"": 0.0, ""distraction_ratio"": 0.3673469387755102, ""site_switches"": 7, ""unique_sites"": 5, ""total_entries"": 49}",5,0,3
2025-06-22 02:40:15,https://learninglab.si.edu/,0.0,encourage,5,Great choice with the Smithsonian Learning Lab! Keep exploring and learning.,"The student is on an educational site with a good focus score, so positive reinforcement is appropriate.",low,True,"{""inappropriate"": false, ""category"": null, ""confidence"": 0.95, ""description"": ""The screenshot shows the Smithsonian Learning Lab website, which is an educational resource platform."", ""action_needed"": null}","{""pattern"": ""mixed_activity"", ""trend"": ""declining"", ""focus_score"": 8.36734693877551, ""educational_ratio"": 0.0, ""distraction_ratio"": 0.24489795918367346, ""site_switches"": 8, ""unique_sites"": 6, ""total_entries"": 49}",5,0,4
2025-06-22 02:40:39,https://learninglab.si.edu/,25.293846,encourage,5,Great job exploring the Smithsonian Learning Lab! Keep up the good work!,"Student is on an educational site, showing good focus score, and no recent warnings.",low,True,"{""inappropriate"": false, ""category"": null, ""confidence"": 0.95, ""description"": ""The screenshot shows the Smithsonian Learning Lab website, which is an educational resource."", ""action_needed"": null}","{""pattern"": ""mixed_activity"", ""trend"": ""declining"", ""focus_score"": 8.75, ""educational_ratio"": 0.0, ""distraction_ratio"": 0.20833333333333334, ""site_switches"": 6, ""unique_sites"": 6, ""total_entries"": 48}",6,0,4
2025-06-22 02:41:05,https://learninglab.si.edu/,49.475336,warn,5,"Because I'm sensing some frustration or sadness, I'm suggesting you take a short break. It can help to step away for a moment.",High negative emotions on an entertainment page. Suggesting a break.,high,True,"{""inappropriate"": false, ""category"": null, ""confidence"": 0.95, ""description"": ""The screenshot shows the Smithsonian Learning Lab website, which is an educational resource platform."", ""action_needed"": null}","{""pattern"": ""mixed_activity"", ""trend"": ""declining"", ""focus_score"": 8.823529411764707, ""educational_ratio"": 0.0, ""distraction_ratio"": 0.19607843137254902, ""site_switches"": 6, ""unique_sites"": 6, ""total_entries"": 51}",7,0,4
2025-06-22 02:41:38,https://learninglab.si.edu/,75.012348,intervene,5,"I've noticed you seem very happy right now, which is great! Based on that, I'm redirecting you to an educational site to channel that positive energy into learning.",High happiness detected on an entertainment page. Redirecting to maintain productivity.,medium,True,"{""inappropriate"": false, ""category"": null, ""confidence"": 0.95, ""description"": ""The screenshot shows the Smithsonian Learning Lab, an educational website."", ""action_needed"": null}","{""pattern"": ""mixed_activity"", ""trend"": ""declining"", ""focus_score"": 8.90909090909091, ""educational_ratio"": 0.0, ""distraction_ratio"": 0.18181818181818182, ""site_switches"": 6, ""unique_sites"": 6, ""total_entries"": 55}",7,1,4
2025-06-22 02:42:06,https://www.history.com/,0.0,encourage,3,Great job exploring history! Keep up the good work.,The student is on a history-related website and has a high focus score. Positive reinforcement can motivate continued engagement.,low,True,"{""inappropriate"": false, ""category"": null, ""confidence"": 0.95, ""description"": ""The screenshot shows a website with a pop-up about updated terms of use. The content appears to be related to history and educational topics."", ""action_needed"": null}","{""pattern"": ""mixed_activity"", ""trend"": ""declining"", ""focus_score"": 8.833333333333334, ""educational_ratio"": 0.0, ""distraction_ratio"": 0.16666666666666666, ""site_switches"": 7, ""unique_sites"": 7, ""total_entries"": 60}",7,1,5
2025-06-22 02:42:28,https://www.history.com/,21.46132,encourage,5,Great job exploring history! Keep up the good work!,"The student is on an educational website related to history. Their browsing focus score is high, and previous interventions have been mostly positive.",low,True,"{""inappropriate"": false, ""category"": null, ""confidence"": 0.95, ""description"": ""The screenshot shows a website with a terms of use update notification. The content appears to be related to history and educational topics."", ""action_needed"": null}","{""pattern"": ""mixed_activity"", ""trend"": ""declining"", ""focus_score"": 8.90625, ""educational_ratio"": 0.0, ""distraction_ratio"": 0.15625, ""site_switches"": 7, ""unique_sites"": 7, ""total_entries"": 64}",8,1,5
2025-06-22 02:42:53,https://www.history.com/,45.179043,encourage,5,Great job exploring history! Keep up the focus!,"The student has been on an educational site, showing focus. Positive reinforcement can help maintain this behavior.",low,True,"{""inappropriate"": false, ""category"": null, ""confidence"": 0.95, ""description"": ""The screenshot shows a website with a Terms of Use update notification. The content appears to be related to history and educational topics."", ""action_needed"": null}","{""pattern"": ""mixed_activity"", ""trend"": ""declining"", ""focus_score"": 8.970588235294118, ""educational_ratio"": 0.0, ""distraction_ratio"": 0.14705882352941177, ""site_switches"": 7, ""unique_sites"": 7, ""total_entries"": 68}",9,1,5
2025-06-22 02:43:17,https://www.history.com/,69.84803,encourage,5,Great job exploring history! Keep up the good work.,The student is on an educational site related to history and their focus score is high. Positive reinforcement is beneficial.,low,True,"{""inappropriate"": false, ""category"": null, ""confidence"": 0.95, ""description"": ""The screenshot shows a website with a terms of use update notification. The content appears to be related to history and educational topics."", ""action_needed"": ""None""}","{""pattern"": ""mixed_activity"", ""trend"": ""declining"", ""focus_score"": 9.027777777777779, ""educational_ratio"": 0.0, ""distraction_ratio"": 0.1388888888888889, ""site_switches"": 7, ""unique_sites"": 7, ""total_entries"": 72}",10,1,5
2025-06-22 02:43:41,https://www.history.com/,94.576646,encourage,5,Great job exploring history! Keep up the good work.,The student has been on an educational site for a decent amount of time and their focus score is high.,low,True,"{""inappropriate"": false, ""category"": null, ""confidence"": 0.95, ""description"": ""The screenshot shows a website with a pop-up about updated terms of use. The content appears to be related to history and educational topics."", ""action_needed"": null}","{""pattern"": ""mixed_activity"", ""trend"": ""declining"", ""focus_score"": 9.09090909090909, ""educational_ratio"": 0.0, ""distraction_ratio"": 0.12987012987012986, ""site_switches"": 7, ""unique_sites"": 7, ""total_entries"": 77}",11,1,5
2025-06-22 02:44:15,https://www.history.com/,127.806412,encourage,5,Great job exploring history! Keep up the focus!,The student has been on an educational site for a decent amount of time and has a high focus score. Positive reinforcement can help maintain this momentum.,low,True,"{""inappropriate"": false, ""category"": null, ""confidence"": 0.9, ""description"": ""The screenshot shows a website with a terms of use update notification. The content appears to be related to history and educational material."", ""action_needed"": ""None""}","{""pattern"": ""mixed_activity"", ""trend"": ""declining"", ""focus_score"": 9.146341463414634, ""educational_ratio"": 0.0, ""distraction_ratio"": 0.12195121951219512, ""site_switches"": 7, ""unique_sites"": 7, ""total_entries"": 82}",12,1,5
2025-06-22 02:44:40,https://www.history.com/,152.74325,encourage,5,Great job exploring history! Keep up the good work.,The student has been on an educational site for a decent amount of time and their focus score is high.,low,True,"{""inappropriate"": false, ""category"": null, ""confidence"": 0.95, ""description"": ""The screenshot shows a website with a pop-up about updated terms of use. The content appears to be related to history and educational topics."", ""action_needed"": null}","{""pattern"": ""mixed_activity"", ""trend"": ""declining"", ""focus_score"": 9.195402298850574, ""educational_ratio"": 0.0, ""distraction_ratio"": 0.11494252873563218, ""site_switches"": 7, ""unique_sites"": 7, ""total_entries"": 87}",13,1,5
2025-06-22 02:45:04,https://www.history.com/,177.019351,encourage,5,Great job exploring history! Keep up the focused work.,The student has been on an educational site for a decent amount of time with a high focus score. Positive reinforcement will encourage continued engagement.,low,True,"{""inappropriate"": false, ""category"": null, ""confidence"": 0.95, ""description"": ""The screenshot shows a website with a pop-up about updated terms of use. The content appears to be related to history and educational topics."", ""action_needed"": ""None""}","{""pattern"": ""mixed_activity"", ""trend"": ""declining"", ""focus_score"": 9.23076923076923, ""educational_ratio"": 0.0, ""distraction_ratio"": 0.10989010989010989, ""site_switches"": 7, ""unique_sites"": 7, ""total_entries"": 91}",14,1,5
2025-06-22 02:45:27,https://www.history.com/,200.853167,encourage,5,Great job exploring history! Keep up the good work!,The student has been on an educational site for a good amount of time and their focus score is high.,low,True,"{""inappropriate"": false, ""category"": null, ""confidence"": 0.9, ""description"": ""The screenshot shows a website with a pop-up about updated terms of use. The content appears to be related to history and educational topics."", ""action_needed"": null}","{""pattern"": ""mixed_activity"", ""trend"": ""declining"", ""focus_score"": 9.263157894736842, ""educational_ratio"": 0.0, ""distraction_ratio"": 0.10526315789473684, ""site_switches"": 7, ""unique_sites"": 7, ""total_entries"": 95}",15,1,5
2025-06-22 02:45:51,https://www.history.com/,224.049356,encourage,5,Great job staying focused on history! Keep up the good work!,The student has been on a history-related site for a decent amount of time with a high focus score.,low,True,"{""inappropriate"": false, ""category"": null, ""confidence"": 0.95, ""description"": ""The screenshot shows a website with a pop-up about updated terms of use. The site appears to be related to history content."", ""action_needed"": null}","{""pattern"": ""mixed_activity"", ""trend"": ""declining"", ""focus_score"": 9.278350515463918, ""educational_ratio"": 0.0, ""distraction_ratio"": 0.10309278350515463, ""site_switches"": 7, ""unique_sites"": 7, ""total_entries"": 97}",16,1,5
2025-06-22 02:46:24,https://www.history.com/,257.259099,encourage,5,Great job exploring historical content! Keep up the good work.,The student has been focused on a historical website for a decent amount of time and their browsing patterns show a strong focus score. Positive reinforcement can help maintain their engagement.,low,True,"{""inappropriate"": false, ""category"": null, ""confidence"": 0.95, ""description"": ""The screenshot shows a website with a terms of use update notification. It appears to be related to historical content."", ""action_needed"": null}","{""pattern"": ""mixed_activity"", ""trend"": ""declining"", ""focus_score"": 9.375, ""educational_ratio"": 0.0, ""distraction_ratio"": 0.10416666666666667, ""site_switches"": 6, ""unique_sites"": 6, ""total_entries"": 96}",17,1,5
2025-06-22 02:46:48,https://www.history.com/,281.231689,encourage,5,Great job exploring history! Keep up the good work.,The student has been on an educational site for a decent amount of time with a high focus score. Positive reinforcement can help maintain their motivation.,low,True,"{""inappropriate"": false, ""category"": null, ""confidence"": 0.95, ""description"": ""The screenshot shows a website with a pop-up about updated Terms of Use. The content appears to be related to history and educational topics."", ""action_needed"": ""No action needed""}","{""pattern"": ""mixed_activity"", ""trend"": ""declining"", ""focus_score"": 9.375, ""educational_ratio"": 0.0, ""distraction_ratio"": 0.10416666666666667, ""site_switches"": 6, ""unique_sites"": 6, ""total_entries"": 96}",18,1,5
2025-06-22 02:47:12,https://www.history.com/,304.93805,encourage,5,Great job exploring historical content! Keep up the focus!,The student has been on a history-related site for a decent amount of time with a high focus score. Positive reinforcement will help maintain their engagement.,low,True,"{""inappropriate"": false, ""category"": null, ""confidence"": 0.9, ""description"": ""The screenshot displays a website with a pop-up about updated Terms of Use. It appears to be related to historical content."", ""action_needed"": null}","{""pattern"": ""mixed_activity"", ""trend"": ""declining"", ""focus_score"": 9.375, ""educational_ratio"": 0.0, ""distraction_ratio"": 0.10416666666666667, ""site_switches"": 6, ""unique_sites"": 6, ""total_entries"": 96}",19,1,5
